date,text,stars
11/27/2023,"I ordered online at about 1am.  TV was delivered to my house at 8:15 am. WOW. 
East hook up. Good picture  priced right.",5 out of 5 stars review
11/19/2023,"Super picture, easy set up- all at  Great Value! I am very pleased with Vizio! This is my 4th Vizio Tv purchase- always pleased with Vizio",5 out of 5 stars review
12/2/2023,The picture on this TV is excellent.  Easy to navigate apps and I love the voice search on the remote.,5 out of 5 stars review
11/24/2023,I BOUGHT A 55 INCH VIZIO TV BACK IN 2008 AND IT IS STILL WORKING. NOW I BOUGHT A BIGER 75 INCH. SO I HOPE IT STILL LIVE UP TO ITS NAME,5 out of 5 stars review
11/24/2023,My first SmartTv  - my Dtr and granddaughter set it up for me. Nice color and I love the voice activated remote that responds when I talk into it.,5 out of 5 stars review
12/20/2023,"Best price in town. Next day delivery was free and on time. Set up was easy. Ordered,delivered, and watching in less than 24 hours",5 out of 5 stars review
12/14/2023,"I’ve nothing bad to say about Vizio tv’s
I’ve owned Vizio for years!
Matter of fact getting ready to order a 65 inch Vizio Tv",5 out of 5 stars review
12/6/2023,I don't know for sure if this is a tv my son will like yet since it is a Christmas gift. He will not receive it till then,5 out of 5 stars review
12/21/2023,this tv shows a crisp clear picture !!!! i love the fact that i can use my phone as the remote control!!! this is an awesome television,5 out of 5 stars review
11/16/2023,It’s so easy to use beautiful picture I love the remote that comes with it I’m going to buy another one soon,5 out of 5 stars review
11/18/2023,"The color isn't perfect, and it doesn't stream as well as a firestick, but it's great for the price.",5 out of 5 stars review
10/29/2023,Delivery was fast. Setup was easy! Picture is great. Sound is not great. Needs a sound bar. But it's definitely worth the cost.,5 out of 5 stars review
11/23/2023,Video upscale ACTUALLY WORKS. After years of false advertising by virtually all tech brands this company delivers a quality product!,5 out of 5 stars review
10/28/2023,For the price it is a very high quality TV for sure. I’ve had it for 4 months now and haven’t regretted the purchase!,5 out of 5 stars review
12/7/2023,"It was delivered to brother in CALIFORNIA within 10 minutes of my ordering it from Walmart near his home.
I like in Kentucky. He loved it.",5 out of 5 stars review
12/11/2023,I love Vizio. It functions the same as my old tv but its bigger and the picture quality is so crisp!,5 out of 5 stars review
11/20/2023,The Vizio 50 inch tv that was purchased has a great picture and was very easy to setup . The price was fantastic !,5 out of 5 stars review
11/21/2023,"I love this tv. Excellent, clear picture, great sound. No issues loading or streaming. I have other Vizio's and wouldn't hesitate to buy another one.",5 out of 5 stars review
12/18/2023,love all free channels it has but you have to have internet for it. Picture is very nice. Sound is very good.,5 out of 5 stars review
11/9/2023,Tv was at an awesome price and even better in person.  Super easy set up!  Got the same day delivery….dynamite and well worth it!,5 out of 5 stars review
11/18/2023,Very pleased with this Tv. The picture is crisp and sharp. It runs super fast and the set up was quick and super easy.,5 out of 5 stars review
12/12/2023,"Vizio has proven to be reliable for years.  Have given two others away to family.
Also accessible customer service.",5 out of 5 stars review
11/4/2023,"WOW! Loved the 2 we bought for LAKE. Now, 6 months later we're buying 3rd for our Primary Residence! Can not beat the Price/ Quality!",5 out of 5 stars review
11/9/2023,our previous Vizio 55 in lasted us 7 years and finally bit the dust. so it was only logical to go get another one!,5 out of 5 stars review
11/13/2023,easy to set up good picture only drawback theres no timer to set it to come on ( vacation mode) only a sleep timer,5 out of 5 stars review
12/13/2023,I love that it has the smart voice remote. It also has all the streaming apps and gives really great suggestions. This was a great tv for the price.,5 out of 5 stars review
11/6/2023,Just as described. So far it's been amazing. Fits perfectly. Picture and color very clear. Considering buying another one for my grandson.,5 out of 5 stars review
12/11/2023,Bought this as a gift for my parents in another country and it traveled over the ocean and still work great- they love it very clear images.,5 out of 5 stars review
12/3/2023,i ordered it monday night at 10pm-ish. I had it at my house by 1143am the following day. everything is excellent.,5 out of 5 stars review
12/10/2023,"We purchased this TV for a raffle giveaway, it was a hit! Such an amazing product for such a great price! Will be purchasing again!",5 out of 5 stars review
11/8/2023,I have 4 Vizio TVs and they never disappoint great picture quality and are easy to use love the new remote and new features,5 out of 5 stars review
12/13/2023,I really like the picture quality. The size is perfect for the room it’s in. Sound quality is great as well.,5 out of 5 stars review
11/23/2023,Great tv. Good picture quality. Sound is lousy so get a good Visio sound bar with it. Price was very good.,5 out of 5 stars review
12/10/2023,"It fix my stand perfectly, the picture is good so far, I had a little trouble at first because I had a fire stick on it to.",5 out of 5 stars review
12/15/2023,This TV is great. The picture couldn’t be better and the color is awesome. I would definitely go this TV,5 out of 5 stars review
12/11/2023,I love this TV I bought 1 in 2016 did not have the sound I have on my older 1 so I bought the sound bar and sub I love it!,5 out of 5 stars review
11/25/2023,"Great value, great picture. My only complaint would be that the sound don't seem to be as good as my LG was (volume)",5 out of 5 stars review
12/2/2023,I love football. Ga. Fla. weekend we set it outside for our gang to watch the game. Everyone spoke about the nice view and color of this set.,5 out of 5 stars review
12/2/2023,"was bought for a gift, the delivery was on time and the driver was very polite and carried it up to my apartment as I am handicapped",5 out of 5 stars review
11/20/2023,even before installing my apps too many free channels and clear picture *get a good sound bar. everything else is gold,5 out of 5 stars review
12/2/2023,Bought for my mother in law for Christmas as hers broke. Delivery was quick and no problems. TV was easy to set up and she loves it!,5 out of 5 stars review
11/17/2023,"I am really satisfied with the TV itself, but the remote is trash.  It doesn't have any number keys or channel arrows.",5 out of 5 stars review
11/3/2023,"This Vizio has a great picture, easy to set up, and a great price. Packaged well and arrived on time. Our 2nd Vizio and both are great.",5 out of 5 stars review
11/1/2023,"This TV has a really good picture.  Got it installed Saturday. Still trying to figure everything out. 
This is an early Christmas present.",5 out of 5 stars review
11/23/2023,Worth the money. Very easy to set up and work with. Picture quality is very good. I’m very happy with my purchase.,5 out of 5 stars review
12/3/2023,Great picture quality and clarity. Lightweight for size. User-friendly platform/OS. Easily compatible with surround sound system.,5 out of 5 stars review
11/25/2023,"Item was delivered to front door as requested, however the driver did not get my signature. Otherwise great delivery!",5 out of 5 stars review
12/17/2023,I love this tv. it’s a new model from the old one I have. The color and the picture in the screen it’s very nice. It worth the price.,5 out of 5 stars review
11/16/2023,"everything was prompt from me ordering, picking up, an leaving. it was on point.... Highly Recommend!!",5 out of 5 stars review
11/28/2023,I brought the television for my guys birthday and he absolutely loves it. He said and I quote “It’s All That” end quote,5 out of 5 stars review
12/6/2023,"great size quality, we bought this brand before and didn't disappoint us! So we went again but bigger, it's a great tv",5 out of 5 stars review
11/29/2023,I've enjoyed Vivio tv's %26 knew it was time to upgrade to 4K. Easy to setup %26 have enjoyed it from the moment I took it out of the box.,5 out of 5 stars review
12/20/2023,"tv was easy to set up, and the picture and sound are phenomenal..a great price and great features i highly recommend this tv",5 out of 5 stars review
12/15/2023,Nice tv and great price. Vizio includes a lot of free content. I like being able to use my phone as remote.,5 out of 5 stars review
12/2/2023,I needed (wanted) a larger tv for the living room. This 55” Vizio is perfect. Great sound and is easy to view.,5 out of 5 stars review
11/28/2023,"The service we received during the purchase of our TV was great. And the delivery was quick and great, too.",5 out of 5 stars review
11/13/2023,The TV has addition movie channels that come free because you have a vizio TV.  It saves you money on cable and movie subscriptions.,5 out of 5 stars review
11/26/2023,Had this tv a couple of months now and we love it! The Visio Home Screen makes everything organized and ready your fingertips,5 out of 5 stars review
11/19/2023,Easy to set up and connect to WiFi and Verizon.  Very pleased with settings that allow adjustments for commercials volume.,5 out of 5 stars review
11/17/2023,This is a great tv for the price. I had a previous Vizio tv that lasted more than 10 years. Great brand for the money.,5 out of 5 stars review
12/22/2023,"Absolutely love the tv! The only con I can note is Crunchyroll isnt available for download, but we have workaround. Overall, a great buy!",5 out of 5 stars review
11/28/2023,The tv was easy to install. The only problem i am having is getting the vizo sound bar to work with it.,5 out of 5 stars review
10/29/2023,VIZIO is a very dependable brand. I use them for events and they take a beating being moved around from place to place.,5 out of 5 stars review
9/13/2023,My mom %26 I LOVE the TV!!,5 out of 5 stars review
9/5/2023,Best looking tv I've owned. Love it makes my ps5 sing,5 out of 5 stars review
1/9/2024,very beautiful and I am so proud and happy,5 out of 5 stars review
10/8/2023,Great picture and features for a great value.,5 out of 5 stars review
7/8/2023,Great tv with beautiful picture and good sound. Would definitely recommend.,5 out of 5 stars review
12/26/2023,My order was shipped and received in a timely manner.,5 out of 5 stars review
1/19/2024,This tv is a great size and works well with our AppleTV and Vizio surround system.,5 out of 5 stars review
1/18/2024,This tv is excellent for the price.  The picture is very clear. We would but it again.,5 out of 5 stars review
1/17/2024,"Love the Voice Command!!!
Ton's of free channels!!!",5 out of 5 stars review
1/1/2024,Love the picture!  User friendly.,5 out of 5 stars review
12/31/2023,great tv just the right size and lightweight,5 out of 5 stars review
1/23/2024,This smart tv is nice good sound great picture well worth the price,5 out of 5 stars review
1/12/2024,love the picture quality.  Great value for the size,5 out of 5 stars review
1/3/2024,love my purchase and great service delivering. Glad updating my TV to a smart tv. love it,5 out of 5 stars review
1/14/2024,"Great picture, great sound, ease of using apps with the remote. So far I love this tv!!!",5 out of 5 stars review
1/7/2024,"works great, good picture, a real steal for less than $200",5 out of 5 stars review
1/14/2024,Seems to be a good television,5 out of 5 stars review
1/21/2024,"Good picture, good sound, good price.",5 out of 5 stars review
7/12/2023,Love this tv especially for the price. Speakers aren’t as loud but pairs will with a sound bar.,5 out of 5 stars review
1/11/2024,Crystal clear picture!  Great price!!!,5 out of 5 stars review
1/12/2024,tv is great was very easy to put together!,5 out of 5 stars review
12/26/2023,The price was affordable and I got it on Xmas eve can’t beat that,5 out of 5 stars review
1/23/2024,tv color is outstanding  and easy to setup wifi.,5 out of 5 stars review
1/24/2024,"Great value, quick delivery.",5 out of 5 stars review
1/24/2024,I ordered it one morning and got it the same afternoon,5 out of 5 stars review
1/5/2024,"The price and the product quality, at this moment.",5 out of 5 stars review
1/7/2024,Easy to order and fast delivery and tv works great,5 out of 5 stars review
7/14/2023,Well packaged and delivered on time. Third Visio over 12 years. Never any issues. Good quality.,5 out of 5 stars review
1/17/2024,"Best decision for the price, recommend this tv.",5 out of 5 stars review
1/16/2024,This is a great television for sure,5 out of 5 stars review
1/19/2024,great tv and picture is clear.  the price was great too.,5 out of 5 stars review
1/23/2024,"The TV was returned the person I gave it to for a gift  refused it, said it was to big",5 out of 5 stars review
1/14/2024,I really liked the TV.  Perfect size and picture. Would buy again.,5 out of 5 stars review
12/28/2023,Great quality on the screen! Easy to use!,5 out of 5 stars review
9/7/2023,"Like size, product brand warranty parents anniversary gift..",5 out of 5 stars review
12/27/2023,they delivered right to his room in nursing home very helpful. nice tv,5 out of 5 stars review
1/6/2024,Awesome tv. Vizio always has great tvs,5 out of 5 stars review
12/31/2023,Great TV for the price. The size was great.,5 out of 5 stars review
1/16/2024,Vizeo TVs never disappoint. This is my fifth Vizeo and the performance is amazing!,5 out of 5 stars review
1/19/2024,i love this tv. I felt it was a great value and the picture is very clear.,5 out of 5 stars review
8/26/2023,Great picture and size!!!,5 out of 5 stars review
8/12/2023,The quality of the tv is awesome really enjoying the 4k resolution,5 out of 5 stars review
1/14/2024,my item was brought out to me very quickly after i arrived,5 out of 5 stars review
12/27/2023,against other reviews this tv is pretty decent no problems better than the TCL brand,5 out of 5 stars review
1/12/2024,I bought the 65-inch TV end of December and so far it has been good. I like the  Vizio.,5 out of 5 stars review
1/23/2024,So far so good. The TV has great sound and picture. Perfect for my living room.,5 out of 5 stars review
1/18/2024,Love the color and easy to set up.,5 out of 5 stars review
1/10/2024,"Great all around television for watching movies, football and playing video games.",5 out of 5 stars review
7/14/2023,"Good but not a good quality , the tv is coo",5 out of 5 stars review
1/9/2024,Vizio really stepped its game up,5 out of 5 stars review
1/5/2024,this was the best purchase I made in 2023!!  i encourage anyone to check out vizio products.,5 out of 5 stars review
1/15/2024,Shows all the best movies and shows love my smart tv,5 out of 5 stars review
1/10/2024,Great quality. Great price,5 out of 5 stars review
1/4/2024,Great picture and vibrant colors.,5 out of 5 stars review
8/10/2023,Love the quality for the price.  Great addition to my  family!,5 out of 5 stars review
1/20/2024,This is a great tv for the price. Picture quality and all. Wonderful,5 out of 5 stars review
1/2/2024,I am loving this Vizio tv.,5 out of 5 stars review
1/8/2024,TV works great. Very happy with it.,5 out of 5 stars review
1/16/2024,good picture for the price,5 out of 5 stars review
1/18/2024,Great Shipping! You will probably need a sound bar but otherise a great tv!,5 out of 5 stars review
1/2/2024,I put this tv in a room and I love it.,5 out of 5 stars review
1/11/2024,This is a nice television with clear picture,5 out of 5 stars review
1/1/2024,Love the TV and price was good,5 out of 5 stars review
1/21/2024,Look for the bargain by researching the walmart web,5 out of 5 stars review
1/8/2024,I bought this TV for my elderly parents. It’s very easy to use in the picture quality is wonderful.,5 out of 5 stars review
1/4/2024,Vizio has come a long way. They offer a nice product at a competitive price.,5 out of 5 stars review
12/26/2023,Great quality! Amazing sound and picture.....,5 out of 5 stars review
8/11/2023,Great price for a big screen. We have purchased VISIO TVs and find they are good quality TVs,5 out of 5 stars review
7/21/2023,Love the quality and how light it is,5 out of 5 stars review
1/9/2024,bought this for my husband as a Chris gift and he enjoys it!,5 out of 5 stars review
1/6/2024,"Very satisfied, easy set-up great picture.",5 out of 5 stars review
1/3/2024,bought online received same day.,5 out of 5 stars review
1/9/2024,Love this tv! Easy set up!,5 out of 5 stars review
8/28/2023,The price for this size and quality is nice! No problems so far and setup was easy.,5 out of 5 stars review
12/29/2023,it was too big for are room,5 out of 5 stars review
12/28/2023,The picture on this TV is super clean and clear I love it!,5 out of 5 stars review
12/31/2023,"Tv is easy to setup, great 4k picture.  Delivery was exceptional.",5 out of 5 stars review
7/12/2023,Nice picture. Nice price. Great quality.,5 out of 5 stars review
12/27/2023,bought it for a Christmas gift,5 out of 5 stars review
12/28/2023,Excellent picture quality 👌,5 out of 5 stars review
1/22/2024,Beautiful picture; easy to install; easy to set up!,5 out of 5 stars review
1/21/2024,TV has a great picture and sound. Also good deal from Walmart. Had it delivered and it was fast.,5 out of 5 stars review
12/28/2023,Good price wish I needed another,5 out of 5 stars review
8/18/2023,Decent price great quality. This is my second Vizio TV,5 out of 5 stars review
12/29/2023,Looks great and has a great picture for the games!!,5 out of 5 stars review
12/28/2023,I love the size and clear visibility.,5 out of 5 stars review
1/19/2024,Easy to order %26 pick up. Works great!,5 out of 5 stars review
12/29/2023,very nice for the price beautiful picture,5 out of 5 stars review
12/30/2023,Easy set up. Great picture. Adequate sound.,5 out of 5 stars review
1/22/2024,Love Vizio products and this was a great price,5 out of 5 stars review
1/23/2024,This was a gift to my son and daughter-in-law. They were very happy with it.,5 out of 5 stars review
12/26/2023,Placed order in the am and received later in the afternoon.,5 out of 5 stars review
8/31/2023,"Amazing quality, especially for the price",5 out of 5 stars review
1/4/2024,Perfect size. I like remote as well.,5 out of 5 stars review
1/21/2024,Easy to set up! Great picture!,5 out of 5 stars review
1/5/2024,very happy with the delivery.,5 out of 5 stars review
1/17/2024,Easy to hookup. Nice size and price.,5 out of 5 stars review
8/6/2023,beautiful picture very nice quality.,5 out of 5 stars review
1/18/2024,"TV works great. a good buy for your dollar, Good picture. connects the Wi-Fi quick and good sound",5 out of 5 stars review
1/13/2024,great buy highly recommend,5 out of 5 stars review
1/20/2024,The picture is crystal clear!,5 out of 5 stars review
1/10/2024,I just don’t like that I waited so long to get this.,5 out of 5 stars review
1/3/2024,this TV is well worth the money.   picture is beautiful,5 out of 5 stars review
1/16/2024,I love this TV! No issues whatsoever.,5 out of 5 stars review
8/29/2023,"great price, good quality!!!",5 out of 5 stars review
1/2/2024,"Was delivered with care, perfect size and the picture is amazing happy I purchased",5 out of 5 stars review
1/14/2024,Wonderful tv voice is great,5 out of 5 stars review
1/23/2024,Love the size and color is so much brighter than my previous one.,5 out of 5 stars review
1/4/2024,"Perfect Quality, Perfect Price",5 out of 5 stars review
1/13/2024,This was a Christmas gift.  They love it.,5 out of 5 stars review
1/11/2024,I like Vizio Tv’s .  They are a good value for the price,5 out of 5 stars review
1/10/2024,such a beautiful TV. easy to navigate and the family loves it,5 out of 5 stars review
12/26/2023,Great price for what you get,5 out of 5 stars review
1/9/2024,I love my new tv and great price,5 out of 5 stars review
12/31/2023,Love all the preloaded APPs,5 out of 5 stars review
1/12/2024,Great picture great sound,5 out of 5 stars review
1/3/2024,"I love the tv, great price, nice picture. would highly recommend.",5 out of 5 stars review
12/25/2023,This tv has a very clear picture %26 great sound.,5 out of 5 stars review
1/13/2024,100% Pleased with everything about this V-Series Vizio 4K UHD LED Smart TV V655-J09,5 out of 5 stars review
1/15/2024,Fast delivery and great tv for the price.,5 out of 5 stars review
1/20/2024,Vizio is easy to set up and has a great picture.,5 out of 5 stars review
12/27/2023,"Great buy, grandson loves it",5 out of 5 stars review
12/29/2023,"I like this tv, I have two already. awesome  👌🏼",5 out of 5 stars review
1/15/2024,pulled in posted on app I'd parked and spot number. They brought it out in less than 5 minutes.,5 out of 5 stars review
1/7/2024,"Great Picture , 
great Price.....",5 out of 5 stars review
1/19/2024,Beautiful TV with many features.  Great price.  VERY fast shipping.  I highly recommend!,5 out of 5 stars review
1/18/2024,My parents just don’t want. Afraid they won’t know how to use it,5 out of 5 stars review
1/13/2024,this TV is awesome definitely worth the money,5 out of 5 stars review
1/18/2024,"Have had the set for about a week so far SO   Good,,,",5 out of 5 stars review
1/2/2024,"It's working great, thus far!!!",5 out of 5 stars review
1/4/2024,Nice size beautiful clear picture!,5 out of 5 stars review
1/21/2024,"The Vizio 55"" is a lot bigger than I expected. The picture is clean and set up was a breeze.",5 out of 5 stars review
12/27/2023,If you have a guest room this tv is the best !! I have 6 Vizios and they are the best!,5 out of 5 stars review
1/15/2024,Installation by hello tech was canceled by me. Work was performed by family members,5 out of 5 stars review
1/23/2024,It was a  present for my son and he loved it.. great quality all around,5 out of 5 stars review
1/7/2024,Amazing picture quality!!,5 out of 5 stars review
12/26/2023,"So easy to set up and install, very user friendly, love it",5 out of 5 stars review
1/1/2024,Great features and quality,5 out of 5 stars review
1/18/2024,A good TV for a low price. Love it.,5 out of 5 stars review
1/8/2024,I have complaints. I love this tv!,5 out of 5 stars review
12/26/2023,Good price and great quality. Item is exactly as described,5 out of 5 stars review
1/6/2024,A great TV at an incredibly affordable price.,5 out of 5 stars review
1/7/2024,This was a birthday gift.  Visio is a good television and great price.,5 out of 5 stars review
1/9/2024,Just the right size for my bedroom. Easy set up. Lowered with apps and features.,5 out of 5 stars review
12/26/2023,like the ease of setting it up with all features not hard at all self explanatory,5 out of 5 stars review
12/28/2023,I purchased the TV for my sister and she loves the quality %26 clarity of the picture.,5 out of 5 stars review
1/18/2024,Have had Vizio units for 10 years now and they never dissapoint.  works great in our covered patio.,5 out of 5 stars review
1/10/2024,works great and love this size,5 out of 5 stars review
1/4/2024,"This is a very great tv, the cost and quality is and was great",5 out of 5 stars review
12/30/2023,Easy set up. Light weight. Great picture and price.,5 out of 5 stars review
12/26/2023,"beautiful picture, easy to setup. single remote with easy access buttons!",5 out of 5 stars review
1/14/2024,Arrived on time and helpful.,5 out of 5 stars review
1/3/2024,Like the apps and free tv line up program on tv,5 out of 5 stars review
1/1/2024,liked every thing about it. all my tv's are visio only brand i like,5 out of 5 stars review
1/20/2024,I have had the best luck with this brand of tv !!! Will continue to buy this brand !!,5 out of 5 stars review
1/13/2024,Love it! Great brand I always buy!,5 out of 5 stars review
6/15/2023,The tv was too big for me so my Son in law took it to his house. He totally loved it. You made him a very happy man,5 out of 5 stars review
1/25/2023,"So far we are very pleased with this smart TV.  The colors are brilliant, the sound quality is good.",5 out of 5 stars review
7/8/2022,Easy to set up. Exceptional value for a great quality tv. I would buy this again and highly recommend it.,5 out of 5 stars review
8/21/2023,This is not the first Vizio I have had. We have been satisfied with the previous ones. And the price is really good.,5 out of 5 stars review
10/21/2023,i bought this for my mom.  It replaced a small smart tv in her living room. It was perfect for the price.,5 out of 5 stars review
8/25/2023,Perfect TV for the bedroom! It has a great picture and sound. My last 3 TVs have been Vizio smart TVs and couldn't be happier with them!,5 out of 5 stars review
10/21/2023,The price is very competitive!!!  You are getting a name brand TV for peanuts!!!  So very glad Walmart carries this brand!!!,5 out of 5 stars review
10/12/2023,We like the fact that we can call and get a live person if we run into problem setting it up.  Very friendly agents.,5 out of 5 stars review
10/2/2023,"She helped me carry in the TV, and helped me unbox it and put the feet on. cheerful, sweet, extremely helpful!",5 out of 5 stars review
8/20/2023,"Picked it up yesterday and mounted it to the wall , and it’s so nice ! I love it ! The perfect size for my room (:",5 out of 5 stars review
7/11/2023,We have had the TV for approximately 3 months and havs had zero issues. Easy to use and the picture is clear and beautiful,5 out of 5 stars review
9/10/2023,I really love my tv.I do love how nice is the picture. I bought it for my bedroom and im very happy and satisfied the way it looked.,5 out of 5 stars review
8/18/2023,"I love my new TV! The picture is great, but the sound could be a bit better. very happy with my purchase",5 out of 5 stars review
